{
  "initiative_id": "unified-personal-agent-platform",
  "plan_doc_id": "uap-topology-priority-expansion-plan",
  "plan_item_id": "item-016",
  "target_repo": "rather-not-work-on/platform-contracts",
  "issue_number": 16,
  "project_item_id": "PVTI_002",
  "sync_key": "uap-topology-priority-expansion-plan:item-016:1:rather-not-work-on/platform-contracts",
  "projection_status": "projected"
}
